nvcc: NVIDIA (R) Cuda compiler driver
Copyright (c) 2005-2024 NVIDIA Corporation
Built on Thu_Mar_28_02:18:24_PDT_2024
Cuda compilation tools, release 12.4, V12.4.131
Build cuda_12.4.r12.4/compiler.34097967_0
wandb: Using wandb-core as the SDK backend. Please refer to https://wandb.me/wandb-core for more information.
wandb: Currently logged in as: tzutang-lin (tzu-tang-lin). Use `wandb login --relogin` to force relogin
wandb: Tracking run with wandb version 0.18.3
wandb: Run data is saved locally in /blue/yanjun.li/tzutang.lin/GIGN/GIGN/wandb/run-20241010_084221-scii9imb
wandb: Run `wandb offline` to turn off syncing.
wandb: Syncing run repeat_0
wandb: ⭐️ View project at https://wandb.ai/tzu-tang-lin/finetuning_rep
wandb: 🚀 View run at https://wandb.ai/tzu-tang-lin/finetuning_rep/runs/scii9imb
2024-10-10 08:42:22 - INFO - /blue/yanjun.li/tzutang.lin/GIGN/GIGN/finetuning_pdbbind.py
2024-10-10 08:42:22 - INFO - train data: 81
2024-10-10 08:42:22 - INFO - valid data: 10
./pdbbind_rna_model_fineturn/20241010_084222_GIGN_repeat0/log/train
2024-10-10 08:43:01 - INFO - epoch-0, train_loss-3.1745, train_rmse-1.7817, valid_rmse-1.9062, valid_pr--0.1495
model has been saved to ./pdbbind_rna_model_fineturn/20241010_084222_GIGN_repeat0/model/epoch-0, train_loss-3.1745, train_rmse-1.7817, valid_rmse-1.9062, valid_pr--0.1495.pt.
2024-10-10 08:43:04 - INFO - epoch-1, train_loss-2.5528, train_rmse-1.5978, valid_rmse-1.8452, valid_pr--0.0276
model has been saved to ./pdbbind_rna_model_fineturn/20241010_084222_GIGN_repeat0/model/epoch-1, train_loss-2.5528, train_rmse-1.5978, valid_rmse-1.8452, valid_pr--0.0276.pt.
2024-10-10 08:43:07 - INFO - epoch-2, train_loss-1.6629, train_rmse-1.2896, valid_rmse-1.8147, valid_pr-0.0233
model has been saved to ./pdbbind_rna_model_fineturn/20241010_084222_GIGN_repeat0/model/epoch-2, train_loss-1.6629, train_rmse-1.2896, valid_rmse-1.8147, valid_pr-0.0233.pt.
2024-10-10 08:43:10 - INFO - epoch-3, train_loss-1.3464, train_rmse-1.1603, valid_rmse-1.7896, valid_pr-0.0781
model has been saved to ./pdbbind_rna_model_fineturn/20241010_084222_GIGN_repeat0/model/epoch-3, train_loss-1.3464, train_rmse-1.1603, valid_rmse-1.7896, valid_pr-0.0781.pt.
2024-10-10 08:43:13 - INFO - epoch-4, train_loss-1.2149, train_rmse-1.1022, valid_rmse-1.7416, valid_pr-0.1335
model has been saved to ./pdbbind_rna_model_fineturn/20241010_084222_GIGN_repeat0/model/epoch-4, train_loss-1.2149, train_rmse-1.1022, valid_rmse-1.7416, valid_pr-0.1335.pt.
2024-10-10 08:43:16 - INFO - epoch-5, train_loss-0.9245, train_rmse-0.9615, valid_rmse-1.6915, valid_pr-0.1892
model has been saved to ./pdbbind_rna_model_fineturn/20241010_084222_GIGN_repeat0/model/epoch-5, train_loss-0.9245, train_rmse-0.9615, valid_rmse-1.6915, valid_pr-0.1892.pt.
2024-10-10 08:43:19 - INFO - epoch-6, train_loss-1.0303, train_rmse-1.0150, valid_rmse-1.6147, valid_pr-0.2937
model has been saved to ./pdbbind_rna_model_fineturn/20241010_084222_GIGN_repeat0/model/epoch-6, train_loss-1.0303, train_rmse-1.0150, valid_rmse-1.6147, valid_pr-0.2937.pt.
2024-10-10 08:43:22 - INFO - epoch-7, train_loss-0.7693, train_rmse-0.8771, valid_rmse-1.5425, valid_pr-0.3915
model has been saved to ./pdbbind_rna_model_fineturn/20241010_084222_GIGN_repeat0/model/epoch-7, train_loss-0.7693, train_rmse-0.8771, valid_rmse-1.5425, valid_pr-0.3915.pt.
2024-10-10 08:43:25 - INFO - epoch-8, train_loss-0.6494, train_rmse-0.8059, valid_rmse-1.4751, valid_pr-0.4625
model has been saved to ./pdbbind_rna_model_fineturn/20241010_084222_GIGN_repeat0/model/epoch-8, train_loss-0.6494, train_rmse-0.8059, valid_rmse-1.4751, valid_pr-0.4625.pt.
2024-10-10 08:43:28 - INFO - epoch-9, train_loss-0.6469, train_rmse-0.8043, valid_rmse-1.4269, valid_pr-0.5064
model has been saved to ./pdbbind_rna_model_fineturn/20241010_084222_GIGN_repeat0/model/epoch-9, train_loss-0.6469, train_rmse-0.8043, valid_rmse-1.4269, valid_pr-0.5064.pt.
2024-10-10 08:43:31 - INFO - epoch-10, train_loss-0.5892, train_rmse-0.7676, valid_rmse-1.3807, valid_pr-0.5421
model has been saved to ./pdbbind_rna_model_fineturn/20241010_084222_GIGN_repeat0/model/epoch-10, train_loss-0.5892, train_rmse-0.7676, valid_rmse-1.3807, valid_pr-0.5421.pt.
2024-10-10 08:43:34 - INFO - epoch-11, train_loss-0.5565, train_rmse-0.7460, valid_rmse-1.3679, valid_pr-0.5316
model has been saved to ./pdbbind_rna_model_fineturn/20241010_084222_GIGN_repeat0/model/epoch-11, train_loss-0.5565, train_rmse-0.7460, valid_rmse-1.3679, valid_pr-0.5316.pt.
2024-10-10 08:43:37 - INFO - epoch-12, train_loss-0.5078, train_rmse-0.7126, valid_rmse-1.3757, valid_pr-0.4802
2024-10-10 08:43:40 - INFO - epoch-13, train_loss-0.4040, train_rmse-0.6356, valid_rmse-1.4062, valid_pr-0.3917
2024-10-10 08:43:43 - INFO - epoch-14, train_loss-0.3890, train_rmse-0.6237, valid_rmse-1.4372, valid_pr-0.2991
2024-10-10 08:43:46 - INFO - epoch-15, train_loss-0.4043, train_rmse-0.6359, valid_rmse-1.4687, valid_pr-0.2278
2024-10-10 08:43:49 - INFO - epoch-16, train_loss-0.3584, train_rmse-0.5987, valid_rmse-1.5023, valid_pr-0.1607
2024-10-10 08:43:52 - INFO - epoch-17, train_loss-0.4118, train_rmse-0.6417, valid_rmse-1.5297, valid_pr-0.1061
2024-10-10 08:43:55 - INFO - epoch-18, train_loss-0.2860, train_rmse-0.5347, valid_rmse-1.5642, valid_pr-0.0447
2024-10-10 08:43:58 - INFO - epoch-19, train_loss-0.3097, train_rmse-0.5565, valid_rmse-1.5891, valid_pr-0.0058
2024-10-10 08:44:01 - INFO - epoch-20, train_loss-0.2065, train_rmse-0.4544, valid_rmse-1.6139, valid_pr--0.0326
2024-10-10 08:44:04 - INFO - epoch-21, train_loss-0.2561, train_rmse-0.5060, valid_rmse-1.6372, valid_pr--0.0639
2024-10-10 08:44:07 - INFO - epoch-22, train_loss-0.2394, train_rmse-0.4893, valid_rmse-1.6604, valid_pr--0.0947
2024-10-10 08:44:10 - INFO - epoch-23, train_loss-0.2886, train_rmse-0.5372, valid_rmse-1.6846, valid_pr--0.1289
2024-10-10 08:44:13 - INFO - epoch-24, train_loss-0.1997, train_rmse-0.4469, valid_rmse-1.7020, valid_pr--0.1506
2024-10-10 08:44:15 - INFO - epoch-25, train_loss-0.1950, train_rmse-0.4415, valid_rmse-1.7154, valid_pr--0.1704
2024-10-10 08:44:18 - INFO - epoch-26, train_loss-0.1938, train_rmse-0.4403, valid_rmse-1.7172, valid_pr--0.1721
2024-10-10 08:44:21 - INFO - epoch-27, train_loss-0.1996, train_rmse-0.4468, valid_rmse-1.7203, valid_pr--0.1665
2024-10-10 08:44:24 - INFO - epoch-28, train_loss-0.1737, train_rmse-0.4167, valid_rmse-1.7200, valid_pr--0.1628
2024-10-10 08:44:27 - INFO - epoch-29, train_loss-0.1534, train_rmse-0.3917, valid_rmse-1.7269, valid_pr--0.1696
2024-10-10 08:44:30 - INFO - epoch-30, train_loss-0.1778, train_rmse-0.4217, valid_rmse-1.7323, valid_pr--0.1806
2024-10-10 08:44:33 - INFO - epoch-31, train_loss-0.1529, train_rmse-0.3910, valid_rmse-1.7383, valid_pr--0.1834
2024-10-10 08:44:36 - INFO - epoch-32, train_loss-0.1435, train_rmse-0.3789, valid_rmse-1.7404, valid_pr--0.1810
2024-10-10 08:44:39 - INFO - epoch-33, train_loss-0.1338, train_rmse-0.3657, valid_rmse-1.7349, valid_pr--0.1736
2024-10-10 08:44:42 - INFO - epoch-34, train_loss-0.1598, train_rmse-0.3997, valid_rmse-1.7340, valid_pr--0.1725
2024-10-10 08:44:45 - INFO - epoch-35, train_loss-0.1429, train_rmse-0.3781, valid_rmse-1.7304, valid_pr--0.1648
2024-10-10 08:44:48 - INFO - epoch-36, train_loss-0.1446, train_rmse-0.3803, valid_rmse-1.7270, valid_pr--0.1593
2024-10-10 08:44:51 - INFO - epoch-37, train_loss-0.1645, train_rmse-0.4056, valid_rmse-1.7240, valid_pr--0.1483
2024-10-10 08:44:54 - INFO - epoch-38, train_loss-0.1321, train_rmse-0.3634, valid_rmse-1.7101, valid_pr--0.1251
2024-10-10 08:44:57 - INFO - epoch-39, train_loss-0.1470, train_rmse-0.3834, valid_rmse-1.7112, valid_pr--0.1249
2024-10-10 08:45:00 - INFO - epoch-40, train_loss-0.1495, train_rmse-0.3866, valid_rmse-1.7140, valid_pr--0.1261
2024-10-10 08:45:03 - INFO - epoch-41, train_loss-0.0974, train_rmse-0.3120, valid_rmse-1.7074, valid_pr--0.1136
2024-10-10 08:45:06 - INFO - epoch-42, train_loss-0.0734, train_rmse-0.2709, valid_rmse-1.7056, valid_pr--0.1091
2024-10-10 08:45:09 - INFO - epoch-43, train_loss-0.0969, train_rmse-0.3114, valid_rmse-1.7005, valid_pr--0.1036
2024-10-10 08:45:12 - INFO - epoch-44, train_loss-0.1076, train_rmse-0.3280, valid_rmse-1.6996, valid_pr--0.1043
2024-10-10 08:45:15 - INFO - epoch-45, train_loss-0.1113, train_rmse-0.3335, valid_rmse-1.6850, valid_pr--0.0917
2024-10-10 08:45:18 - INFO - epoch-46, train_loss-0.1033, train_rmse-0.3214, valid_rmse-1.6818, valid_pr--0.0913
2024-10-10 08:45:21 - INFO - epoch-47, train_loss-0.1053, train_rmse-0.3245, valid_rmse-1.6796, valid_pr--0.0839
2024-10-10 08:45:24 - INFO - epoch-48, train_loss-0.1228, train_rmse-0.3504, valid_rmse-1.6744, valid_pr--0.0785
2024-10-10 08:45:27 - INFO - epoch-49, train_loss-0.1243, train_rmse-0.3526, valid_rmse-1.6744, valid_pr--0.0815
2024-10-10 08:45:30 - INFO - epoch-50, train_loss-0.1210, train_rmse-0.3478, valid_rmse-1.6739, valid_pr--0.0810
2024-10-10 08:45:33 - INFO - epoch-51, train_loss-0.0857, train_rmse-0.2927, valid_rmse-1.6821, valid_pr--0.0963
2024-10-10 08:45:36 - INFO - epoch-52, train_loss-0.1085, train_rmse-0.3295, valid_rmse-1.6785, valid_pr--0.0967
2024-10-10 08:45:39 - INFO - epoch-53, train_loss-0.1263, train_rmse-0.3554, valid_rmse-1.6844, valid_pr--0.1078
2024-10-10 08:45:42 - INFO - epoch-54, train_loss-0.0851, train_rmse-0.2917, valid_rmse-1.6904, valid_pr--0.1089
2024-10-10 08:45:45 - INFO - epoch-55, train_loss-0.0670, train_rmse-0.2588, valid_rmse-1.6919, valid_pr--0.1002
2024-10-10 08:45:48 - INFO - epoch-56, train_loss-0.0712, train_rmse-0.2668, valid_rmse-1.6942, valid_pr--0.0979
2024-10-10 08:45:51 - INFO - epoch-57, train_loss-0.0732, train_rmse-0.2705, valid_rmse-1.6956, valid_pr--0.0957
2024-10-10 08:45:54 - INFO - epoch-58, train_loss-0.0798, train_rmse-0.2825, valid_rmse-1.7000, valid_pr--0.0914
2024-10-10 08:45:57 - INFO - epoch-59, train_loss-0.0677, train_rmse-0.2602, valid_rmse-1.6990, valid_pr--0.0864
2024-10-10 08:46:00 - INFO - epoch-60, train_loss-0.1095, train_rmse-0.3309, valid_rmse-1.7055, valid_pr--0.0897
2024-10-10 08:46:04 - INFO - epoch-61, train_loss-0.0794, train_rmse-0.2817, valid_rmse-1.7010, valid_pr--0.0811
2024-10-10 08:46:07 - INFO - epoch-62, train_loss-0.0552, train_rmse-0.2349, valid_rmse-1.7032, valid_pr--0.0794
2024-10-10 08:46:10 - INFO - epoch-63, train_loss-0.0983, train_rmse-0.3135, valid_rmse-1.6979, valid_pr--0.0748
2024-10-10 08:46:13 - INFO - epoch-64, train_loss-0.0680, train_rmse-0.2608, valid_rmse-1.6948, valid_pr--0.0706
2024-10-10 08:46:16 - INFO - epoch-65, train_loss-0.0852, train_rmse-0.2919, valid_rmse-1.6923, valid_pr--0.0715
2024-10-10 08:46:18 - INFO - epoch-66, train_loss-0.0758, train_rmse-0.2753, valid_rmse-1.6872, valid_pr--0.0732
2024-10-10 08:46:21 - INFO - epoch-67, train_loss-0.0807, train_rmse-0.2840, valid_rmse-1.6878, valid_pr--0.0791
2024-10-10 08:46:25 - INFO - epoch-68, train_loss-0.0578, train_rmse-0.2403, valid_rmse-1.6779, valid_pr--0.0719
2024-10-10 08:46:28 - INFO - epoch-69, train_loss-0.0715, train_rmse-0.2673, valid_rmse-1.6789, valid_pr--0.0785
2024-10-10 08:46:30 - INFO - epoch-70, train_loss-0.0645, train_rmse-0.2540, valid_rmse-1.6817, valid_pr--0.0861
2024-10-10 08:46:33 - INFO - epoch-71, train_loss-0.0832, train_rmse-0.2885, valid_rmse-1.6821, valid_pr--0.0886
2024-10-10 08:46:36 - INFO - epoch-72, train_loss-0.0629, train_rmse-0.2507, valid_rmse-1.6802, valid_pr--0.0858
2024-10-10 08:46:39 - INFO - epoch-73, train_loss-0.0568, train_rmse-0.2383, valid_rmse-1.6896, valid_pr--0.0982
2024-10-10 08:46:42 - INFO - epoch-74, train_loss-0.0687, train_rmse-0.2621, valid_rmse-1.6825, valid_pr--0.0886
2024-10-10 08:46:45 - INFO - epoch-75, train_loss-0.0679, train_rmse-0.2607, valid_rmse-1.6867, valid_pr--0.0885
2024-10-10 08:46:48 - INFO - epoch-76, train_loss-0.0647, train_rmse-0.2544, valid_rmse-1.6939, valid_pr--0.0921
2024-10-10 08:46:51 - INFO - epoch-77, train_loss-0.0590, train_rmse-0.2429, valid_rmse-1.7026, valid_pr--0.0953
2024-10-10 08:46:54 - INFO - epoch-78, train_loss-0.0567, train_rmse-0.2382, valid_rmse-1.7137, valid_pr--0.1067
2024-10-10 08:46:57 - INFO - epoch-79, train_loss-0.0526, train_rmse-0.2294, valid_rmse-1.7177, valid_pr--0.1122
2024-10-10 08:47:00 - INFO - epoch-80, train_loss-0.0593, train_rmse-0.2434, valid_rmse-1.7232, valid_pr--0.1216
2024-10-10 08:47:03 - INFO - epoch-81, train_loss-0.0642, train_rmse-0.2534, valid_rmse-1.7327, valid_pr--0.1367
2024-10-10 08:47:06 - INFO - epoch-82, train_loss-0.0476, train_rmse-0.2182, valid_rmse-1.7417, valid_pr--0.1463
2024-10-10 08:47:09 - INFO - epoch-83, train_loss-0.0505, train_rmse-0.2248, valid_rmse-1.7461, valid_pr--0.1588
2024-10-10 08:47:12 - INFO - epoch-84, train_loss-0.0446, train_rmse-0.2112, valid_rmse-1.7485, valid_pr--0.1617
2024-10-10 08:47:15 - INFO - epoch-85, train_loss-0.0874, train_rmse-0.2956, valid_rmse-1.7609, valid_pr--0.1793
2024-10-10 08:47:18 - INFO - epoch-86, train_loss-0.0740, train_rmse-0.2720, valid_rmse-1.7771, valid_pr--0.1963
2024-10-10 08:47:21 - INFO - epoch-87, train_loss-0.0716, train_rmse-0.2676, valid_rmse-1.7778, valid_pr--0.2111
2024-10-10 08:47:24 - INFO - epoch-88, train_loss-0.0536, train_rmse-0.2316, valid_rmse-1.7768, valid_pr--0.2100
2024-10-10 08:47:27 - INFO - epoch-89, train_loss-0.0904, train_rmse-0.3006, valid_rmse-1.7882, valid_pr--0.2172
2024-10-10 08:47:30 - INFO - epoch-90, train_loss-0.0734, train_rmse-0.2710, valid_rmse-1.7784, valid_pr--0.2100
2024-10-10 08:47:33 - INFO - epoch-91, train_loss-0.0536, train_rmse-0.2316, valid_rmse-1.7811, valid_pr--0.2197
2024-10-10 08:47:36 - INFO - epoch-92, train_loss-0.0636, train_rmse-0.2522, valid_rmse-1.7786, valid_pr--0.2227
2024-10-10 08:47:39 - INFO - epoch-93, train_loss-0.0710, train_rmse-0.2665, valid_rmse-1.7754, valid_pr--0.2221
2024-10-10 08:47:42 - INFO - epoch-94, train_loss-0.0612, train_rmse-0.2474, valid_rmse-1.7716, valid_pr--0.2173
2024-10-10 08:47:45 - INFO - epoch-95, train_loss-0.0652, train_rmse-0.2553, valid_rmse-1.7693, valid_pr--0.2189
2024-10-10 08:47:48 - INFO - epoch-96, train_loss-0.0359, train_rmse-0.1894, valid_rmse-1.7706, valid_pr--0.2188
2024-10-10 08:47:51 - INFO - epoch-97, train_loss-0.0452, train_rmse-0.2126, valid_rmse-1.7669, valid_pr--0.2186
2024-10-10 08:47:54 - INFO - epoch-98, train_loss-0.0461, train_rmse-0.2147, valid_rmse-1.7650, valid_pr--0.2225
2024-10-10 08:47:56 - INFO - epoch-99, train_loss-0.0567, train_rmse-0.2381, valid_rmse-1.7691, valid_pr--0.2281
2024-10-10 08:48:00 - INFO - epoch-100, train_loss-0.0565, train_rmse-0.2377, valid_rmse-1.7714, valid_pr--0.2336
2024-10-10 08:48:02 - INFO - epoch-101, train_loss-0.0685, train_rmse-0.2617, valid_rmse-1.7655, valid_pr--0.2252
2024-10-10 08:48:05 - INFO - epoch-102, train_loss-0.0469, train_rmse-0.2166, valid_rmse-1.7583, valid_pr--0.2163
2024-10-10 08:48:08 - INFO - epoch-103, train_loss-0.0550, train_rmse-0.2346, valid_rmse-1.7647, valid_pr--0.2191
2024-10-10 08:48:11 - INFO - epoch-104, train_loss-0.0692, train_rmse-0.2631, valid_rmse-1.7507, valid_pr--0.2131
2024-10-10 08:48:14 - INFO - epoch-105, train_loss-0.0616, train_rmse-0.2481, valid_rmse-1.7370, valid_pr--0.2044
2024-10-10 08:48:17 - INFO - epoch-106, train_loss-0.0590, train_rmse-0.2428, valid_rmse-1.7284, valid_pr--0.1998
2024-10-10 08:48:19 - INFO - epoch-107, train_loss-0.0579, train_rmse-0.2407, valid_rmse-1.7274, valid_pr--0.2007
2024-10-10 08:48:22 - INFO - epoch-108, train_loss-0.0571, train_rmse-0.2389, valid_rmse-1.7242, valid_pr--0.1943
2024-10-10 08:48:25 - INFO - epoch-109, train_loss-0.0364, train_rmse-0.1908, valid_rmse-1.7214, valid_pr--0.1944
2024-10-10 08:48:28 - INFO - epoch-110, train_loss-0.0498, train_rmse-0.2232, valid_rmse-1.7157, valid_pr--0.1874
2024-10-10 08:48:31 - INFO - epoch-111, train_loss-0.0347, train_rmse-0.1863, valid_rmse-1.7140, valid_pr--0.1847
2024-10-10 08:48:34 - INFO - epoch-112, train_loss-0.0540, train_rmse-0.2325, valid_rmse-1.7127, valid_pr--0.1844
2024-10-10 08:48:34 - INFO - Early stopping in epoch 112. Best RMSE: 1.3679
2024-10-10 08:48:35 - INFO - Training finished and last epoch model saved for repeat 0.
wandb: - 0.024 MB of 0.024 MB uploadedwandb:                                                                                
wandb: 
wandb: Run history:
wandb:      epoch ▁▁▁▁▁▂▂▂▂▂▃▃▃▃▃▄▄▄▄▅▅▅▅▅▅▅▅▆▆▆▆▇▇▇▇█████
wandb: train_loss █▇▅▄▂▂▂▁▁▁▁▁▁▁▁▁▁▁▁▁▁▁▁▁▁▁▁▁▁▁▁▁▁▁▁▁▁▁▁▁
wandb: train_rmse █▆▅▄▄▄▄▃▃▃▂▂▂▂▂▂▂▁▂▂▂▂▁▁▁▁▁▁▁▁▁▁▁▁▁▁▁▁▁▁
wandb:   valid_pr ▃▃█▇▇▄▂▂▂▂▂▂▂▂▂▂▂▂▂▂▂▂▂▂▂▂▂▂▁▁▁▁▁▁▁▁▁▁▁▁
wandb: valid_rmse █▆▃▁▁▂▂▃▃▅▆▆▆▅▅▅▅▅▅▅▅▅▅▅▅▅▅▅▅▅▆▆▆▆▆▆▆▆▆▅
wandb: 
wandb: Run summary:
wandb:      epoch 112
wandb: train_loss 0.05404
wandb: train_rmse 0.23247
wandb:   valid_pr -0.18439
wandb: valid_rmse 1.71266
wandb: 
wandb: 🚀 View run repeat_0 at: https://wandb.ai/tzu-tang-lin/finetuning_rep/runs/scii9imb
wandb: ⭐️ View project at: https://wandb.ai/tzu-tang-lin/finetuning_rep
wandb: Synced 4 W&B file(s), 0 media file(s), 3 artifact file(s) and 0 other file(s)
wandb: Find logs at: ./wandb/run-20241010_084221-scii9imb/logs
wandb: Tracking run with wandb version 0.18.3
wandb: Run data is saved locally in /blue/yanjun.li/tzutang.lin/GIGN/GIGN/wandb/run-20241010_084837-lai2ju2e
wandb: Run `wandb offline` to turn off syncing.
wandb: Syncing run repeat_1
wandb: ⭐️ View project at https://wandb.ai/tzu-tang-lin/finetuning_rep
wandb: 🚀 View run at https://wandb.ai/tzu-tang-lin/finetuning_rep/runs/lai2ju2e
2024-10-10 08:48:38 - INFO - /blue/yanjun.li/tzutang.lin/GIGN/GIGN/finetuning_pdbbind.py
2024-10-10 08:48:38 - INFO - train data: 81
2024-10-10 08:48:38 - INFO - valid data: 10
model has been saved to ./pdbbind_rna_model_fineturn/20241010_084222_GIGN_repeat0/model/last_epoch-112, train_loss-0.0540, train_rmse-0.2325, valid_rmse-1.7127, valid_pr--0.1844.pt.
./pdbbind_rna_model_fineturn/20241010_084838_GIGN_repeat1/log/train
2024-10-10 08:48:41 - INFO - epoch-0, train_loss-3.1361, train_rmse-1.7709, valid_rmse-1.9398, valid_pr--0.1882
model has been saved to ./pdbbind_rna_model_fineturn/20241010_084838_GIGN_repeat1/model/epoch-0, train_loss-3.1361, train_rmse-1.7709, valid_rmse-1.9398, valid_pr--0.1882.pt.
2024-10-10 08:48:44 - INFO - epoch-1, train_loss-2.3095, train_rmse-1.5197, valid_rmse-1.9067, valid_pr--0.0673
model has been saved to ./pdbbind_rna_model_fineturn/20241010_084838_GIGN_repeat1/model/epoch-1, train_loss-2.3095, train_rmse-1.5197, valid_rmse-1.9067, valid_pr--0.0673.pt.
2024-10-10 08:48:47 - INFO - epoch-2, train_loss-1.5116, train_rmse-1.2295, valid_rmse-1.9064, valid_pr--0.0436
model has been saved to ./pdbbind_rna_model_fineturn/20241010_084838_GIGN_repeat1/model/epoch-2, train_loss-1.5116, train_rmse-1.2295, valid_rmse-1.9064, valid_pr--0.0436.pt.
2024-10-10 08:48:50 - INFO - epoch-3, train_loss-1.2583, train_rmse-1.1217, valid_rmse-1.8926, valid_pr--0.0371
model has been saved to ./pdbbind_rna_model_fineturn/20241010_084838_GIGN_repeat1/model/epoch-3, train_loss-1.2583, train_rmse-1.1217, valid_rmse-1.8926, valid_pr--0.0371.pt.
2024-10-10 08:48:53 - INFO - epoch-4, train_loss-1.0500, train_rmse-1.0247, valid_rmse-1.8710, valid_pr--0.0014
model has been saved to ./pdbbind_rna_model_fineturn/20241010_084838_GIGN_repeat1/model/epoch-4, train_loss-1.0500, train_rmse-1.0247, valid_rmse-1.8710, valid_pr--0.0014.pt.
2024-10-10 08:48:56 - INFO - epoch-5, train_loss-0.8821, train_rmse-0.9392, valid_rmse-1.8211, valid_pr-0.0678
model has been saved to ./pdbbind_rna_model_fineturn/20241010_084838_GIGN_repeat1/model/epoch-5, train_loss-0.8821, train_rmse-0.9392, valid_rmse-1.8211, valid_pr-0.0678.pt.
2024-10-10 08:48:59 - INFO - epoch-6, train_loss-0.8449, train_rmse-0.9192, valid_rmse-1.7528, valid_pr-0.1609
model has been saved to ./pdbbind_rna_model_fineturn/20241010_084838_GIGN_repeat1/model/epoch-6, train_loss-0.8449, train_rmse-0.9192, valid_rmse-1.7528, valid_pr-0.1609.pt.
2024-10-10 08:49:02 - INFO - epoch-7, train_loss-0.7329, train_rmse-0.8561, valid_rmse-1.6773, valid_pr-0.2510
model has been saved to ./pdbbind_rna_model_fineturn/20241010_084838_GIGN_repeat1/model/epoch-7, train_loss-0.7329, train_rmse-0.8561, valid_rmse-1.6773, valid_pr-0.2510.pt.
2024-10-10 08:49:05 - INFO - epoch-8, train_loss-0.4876, train_rmse-0.6982, valid_rmse-1.6206, valid_pr-0.2850
model has been saved to ./pdbbind_rna_model_fineturn/20241010_084838_GIGN_repeat1/model/epoch-8, train_loss-0.4876, train_rmse-0.6982, valid_rmse-1.6206, valid_pr-0.2850.pt.
2024-10-10 08:49:08 - INFO - epoch-9, train_loss-0.4981, train_rmse-0.7058, valid_rmse-1.5894, valid_pr-0.2662
model has been saved to ./pdbbind_rna_model_fineturn/20241010_084838_GIGN_repeat1/model/epoch-9, train_loss-0.4981, train_rmse-0.7058, valid_rmse-1.5894, valid_pr-0.2662.pt.
2024-10-10 08:49:11 - INFO - epoch-10, train_loss-0.6236, train_rmse-0.7897, valid_rmse-1.5751, valid_pr-0.1903
model has been saved to ./pdbbind_rna_model_fineturn/20241010_084838_GIGN_repeat1/model/epoch-10, train_loss-0.6236, train_rmse-0.7897, valid_rmse-1.5751, valid_pr-0.1903.pt.
2024-10-10 08:49:14 - INFO - epoch-11, train_loss-0.5186, train_rmse-0.7202, valid_rmse-1.5900, valid_pr-0.0484
2024-10-10 08:49:17 - INFO - epoch-12, train_loss-0.5513, train_rmse-0.7425, valid_rmse-1.6103, valid_pr--0.0681
2024-10-10 08:49:20 - INFO - epoch-13, train_loss-0.4995, train_rmse-0.7067, valid_rmse-1.6392, valid_pr--0.1615
2024-10-10 08:49:23 - INFO - epoch-14, train_loss-0.4633, train_rmse-0.6806, valid_rmse-1.6567, valid_pr--0.1996
2024-10-10 08:49:26 - INFO - epoch-15, train_loss-0.4277, train_rmse-0.6540, valid_rmse-1.6851, valid_pr--0.2427
2024-10-10 08:49:29 - INFO - epoch-16, train_loss-0.3987, train_rmse-0.6315, valid_rmse-1.6919, valid_pr--0.2302
2024-10-10 08:49:32 - INFO - epoch-17, train_loss-0.4002, train_rmse-0.6326, valid_rmse-1.7232, valid_pr--0.2711
2024-10-10 08:49:35 - INFO - epoch-18, train_loss-0.3823, train_rmse-0.6183, valid_rmse-1.7293, valid_pr--0.2599
2024-10-10 08:49:38 - INFO - epoch-19, train_loss-0.3747, train_rmse-0.6121, valid_rmse-1.7489, valid_pr--0.2748
2024-10-10 08:49:41 - INFO - epoch-20, train_loss-0.2754, train_rmse-0.5248, valid_rmse-1.7768, valid_pr--0.2993
2024-10-10 08:49:43 - INFO - epoch-21, train_loss-0.3181, train_rmse-0.5640, valid_rmse-1.8077, valid_pr--0.3176
2024-10-10 08:49:46 - INFO - epoch-22, train_loss-0.2141, train_rmse-0.4627, valid_rmse-1.8216, valid_pr--0.3227
2024-10-10 08:49:49 - INFO - epoch-23, train_loss-0.2099, train_rmse-0.4582, valid_rmse-1.8504, valid_pr--0.3357
2024-10-10 08:49:52 - INFO - epoch-24, train_loss-0.1622, train_rmse-0.4028, valid_rmse-1.8836, valid_pr--0.3448
2024-10-10 08:49:55 - INFO - epoch-25, train_loss-0.1835, train_rmse-0.4284, valid_rmse-1.9052, valid_pr--0.3460
2024-10-10 08:49:58 - INFO - epoch-26, train_loss-0.2179, train_rmse-0.4667, valid_rmse-1.9181, valid_pr--0.3535
2024-10-10 08:50:01 - INFO - epoch-27, train_loss-0.1849, train_rmse-0.4300, valid_rmse-1.9374, valid_pr--0.3678
2024-10-10 08:50:04 - INFO - epoch-28, train_loss-0.1814, train_rmse-0.4259, valid_rmse-1.9463, valid_pr--0.3808
2024-10-10 08:50:07 - INFO - epoch-29, train_loss-0.1340, train_rmse-0.3661, valid_rmse-1.9436, valid_pr--0.3943
2024-10-10 08:50:10 - INFO - epoch-30, train_loss-0.1803, train_rmse-0.4246, valid_rmse-1.9453, valid_pr--0.4091
2024-10-10 08:50:13 - INFO - epoch-31, train_loss-0.1723, train_rmse-0.4150, valid_rmse-1.9372, valid_pr--0.4240
2024-10-10 08:50:16 - INFO - epoch-32, train_loss-0.1474, train_rmse-0.3839, valid_rmse-1.9317, valid_pr--0.4298
2024-10-10 08:50:19 - INFO - epoch-33, train_loss-0.1227, train_rmse-0.3503, valid_rmse-1.9210, valid_pr--0.4315
2024-10-10 08:50:22 - INFO - epoch-34, train_loss-0.1457, train_rmse-0.3817, valid_rmse-1.9153, valid_pr--0.4335
2024-10-10 08:50:25 - INFO - epoch-35, train_loss-0.1613, train_rmse-0.4016, valid_rmse-1.9111, valid_pr--0.4357
2024-10-10 08:50:28 - INFO - epoch-36, train_loss-0.1127, train_rmse-0.3357, valid_rmse-1.8884, valid_pr--0.4197
2024-10-10 08:50:31 - INFO - epoch-37, train_loss-0.1566, train_rmse-0.3957, valid_rmse-1.8815, valid_pr--0.4139
2024-10-10 08:50:34 - INFO - epoch-38, train_loss-0.1419, train_rmse-0.3767, valid_rmse-1.8710, valid_pr--0.4003
2024-10-10 08:50:37 - INFO - epoch-39, train_loss-0.1025, train_rmse-0.3201, valid_rmse-1.8626, valid_pr--0.3898
2024-10-10 08:50:40 - INFO - epoch-40, train_loss-0.0874, train_rmse-0.2956, valid_rmse-1.8482, valid_pr--0.3793
2024-10-10 08:50:43 - INFO - epoch-41, train_loss-0.1141, train_rmse-0.3377, valid_rmse-1.8463, valid_pr--0.3542
2024-10-10 08:50:46 - INFO - epoch-42, train_loss-0.0929, train_rmse-0.3048, valid_rmse-1.8487, valid_pr--0.3490
2024-10-10 08:50:49 - INFO - epoch-43, train_loss-0.0837, train_rmse-0.2893, valid_rmse-1.8473, valid_pr--0.3419
2024-10-10 08:50:52 - INFO - epoch-44, train_loss-0.1197, train_rmse-0.3459, valid_rmse-1.8412, valid_pr--0.3295
2024-10-10 08:50:54 - INFO - epoch-45, train_loss-0.0996, train_rmse-0.3156, valid_rmse-1.8434, valid_pr--0.3263
2024-10-10 08:50:58 - INFO - epoch-46, train_loss-0.0894, train_rmse-0.2990, valid_rmse-1.8412, valid_pr--0.3165
2024-10-10 08:51:01 - INFO - epoch-47, train_loss-0.0801, train_rmse-0.2831, valid_rmse-1.8466, valid_pr--0.3158
2024-10-10 08:51:04 - INFO - epoch-48, train_loss-0.0869, train_rmse-0.2948, valid_rmse-1.8470, valid_pr--0.3148
2024-10-10 08:51:07 - INFO - epoch-49, train_loss-0.0953, train_rmse-0.3088, valid_rmse-1.8501, valid_pr--0.3167
2024-10-10 08:51:10 - INFO - epoch-50, train_loss-0.0934, train_rmse-0.3055, valid_rmse-1.8425, valid_pr--0.2969
2024-10-10 08:51:13 - INFO - epoch-51, train_loss-0.0885, train_rmse-0.2975, valid_rmse-1.8483, valid_pr--0.3075
2024-10-10 08:51:15 - INFO - epoch-52, train_loss-0.0829, train_rmse-0.2879, valid_rmse-1.8526, valid_pr--0.3138
2024-10-10 08:51:18 - INFO - epoch-53, train_loss-0.0894, train_rmse-0.2989, valid_rmse-1.8540, valid_pr--0.3155
2024-10-10 08:51:21 - INFO - epoch-54, train_loss-0.0648, train_rmse-0.2546, valid_rmse-1.8580, valid_pr--0.3203
2024-10-10 08:51:24 - INFO - epoch-55, train_loss-0.1197, train_rmse-0.3460, valid_rmse-1.8648, valid_pr--0.3217
2024-10-10 08:51:27 - INFO - epoch-56, train_loss-0.1263, train_rmse-0.3554, valid_rmse-1.8670, valid_pr--0.3215
2024-10-10 08:51:30 - INFO - epoch-57, train_loss-0.0728, train_rmse-0.2698, valid_rmse-1.8609, valid_pr--0.3164
2024-10-10 08:51:33 - INFO - epoch-58, train_loss-0.0972, train_rmse-0.3117, valid_rmse-1.8534, valid_pr--0.3113
2024-10-10 08:51:36 - INFO - epoch-59, train_loss-0.0760, train_rmse-0.2756, valid_rmse-1.8559, valid_pr--0.3259
2024-10-10 08:51:39 - INFO - epoch-60, train_loss-0.0894, train_rmse-0.2989, valid_rmse-1.8553, valid_pr--0.3409
2024-10-10 08:51:42 - INFO - epoch-61, train_loss-0.0696, train_rmse-0.2639, valid_rmse-1.8567, valid_pr--0.3410
2024-10-10 08:51:46 - INFO - epoch-62, train_loss-0.0699, train_rmse-0.2643, valid_rmse-1.8469, valid_pr--0.3292
2024-10-10 08:51:49 - INFO - epoch-63, train_loss-0.1296, train_rmse-0.3599, valid_rmse-1.8351, valid_pr--0.3197
2024-10-10 08:51:52 - INFO - epoch-64, train_loss-0.0584, train_rmse-0.2416, valid_rmse-1.8301, valid_pr--0.3195
2024-10-10 08:51:55 - INFO - epoch-65, train_loss-0.0869, train_rmse-0.2948, valid_rmse-1.8178, valid_pr--0.3025
2024-10-10 08:51:58 - INFO - epoch-66, train_loss-0.0711, train_rmse-0.2666, valid_rmse-1.8228, valid_pr--0.2994
2024-10-10 08:52:01 - INFO - epoch-67, train_loss-0.0544, train_rmse-0.2333, valid_rmse-1.8227, valid_pr--0.2883
2024-10-10 08:52:04 - INFO - epoch-68, train_loss-0.0568, train_rmse-0.2383, valid_rmse-1.8246, valid_pr--0.2859
2024-10-10 08:52:07 - INFO - epoch-69, train_loss-0.0726, train_rmse-0.2695, valid_rmse-1.8278, valid_pr--0.2717
2024-10-10 08:52:10 - INFO - epoch-70, train_loss-0.0757, train_rmse-0.2751, valid_rmse-1.8304, valid_pr--0.2664
2024-10-10 08:52:13 - INFO - epoch-71, train_loss-0.0803, train_rmse-0.2834, valid_rmse-1.8347, valid_pr--0.2641
2024-10-10 08:52:15 - INFO - epoch-72, train_loss-0.0503, train_rmse-0.2243, valid_rmse-1.8444, valid_pr--0.2632
2024-10-10 08:52:18 - INFO - epoch-73, train_loss-0.0606, train_rmse-0.2461, valid_rmse-1.8487, valid_pr--0.2648
2024-10-10 08:52:21 - INFO - epoch-74, train_loss-0.0896, train_rmse-0.2993, valid_rmse-1.8646, valid_pr--0.2769
2024-10-10 08:52:24 - INFO - epoch-75, train_loss-0.0700, train_rmse-0.2646, valid_rmse-1.8743, valid_pr--0.2904
2024-10-10 08:52:27 - INFO - epoch-76, train_loss-0.0698, train_rmse-0.2643, valid_rmse-1.8636, valid_pr--0.2771
2024-10-10 08:52:30 - INFO - epoch-77, train_loss-0.0773, train_rmse-0.2780, valid_rmse-1.8746, valid_pr--0.2981
2024-10-10 08:52:33 - INFO - epoch-78, train_loss-0.0432, train_rmse-0.2078, valid_rmse-1.8773, valid_pr--0.3038
2024-10-10 08:52:36 - INFO - epoch-79, train_loss-0.0713, train_rmse-0.2669, valid_rmse-1.8868, valid_pr--0.3172
2024-10-10 08:52:39 - INFO - epoch-80, train_loss-0.0586, train_rmse-0.2420, valid_rmse-1.8897, valid_pr--0.3253
2024-10-10 08:52:42 - INFO - epoch-81, train_loss-0.0659, train_rmse-0.2566, valid_rmse-1.8904, valid_pr--0.3290
2024-10-10 08:52:45 - INFO - epoch-82, train_loss-0.0640, train_rmse-0.2530, valid_rmse-1.8942, valid_pr--0.3357
2024-10-10 08:52:48 - INFO - epoch-83, train_loss-0.0614, train_rmse-0.2479, valid_rmse-1.8979, valid_pr--0.3402
2024-10-10 08:52:51 - INFO - epoch-84, train_loss-0.0672, train_rmse-0.2593, valid_rmse-1.8960, valid_pr--0.3421
2024-10-10 08:52:54 - INFO - epoch-85, train_loss-0.0780, train_rmse-0.2794, valid_rmse-1.8900, valid_pr--0.3436
2024-10-10 08:52:57 - INFO - epoch-86, train_loss-0.0481, train_rmse-0.2194, valid_rmse-1.8859, valid_pr--0.3393
2024-10-10 08:53:00 - INFO - epoch-87, train_loss-0.0589, train_rmse-0.2428, valid_rmse-1.8814, valid_pr--0.3382
2024-10-10 08:53:03 - INFO - epoch-88, train_loss-0.0506, train_rmse-0.2249, valid_rmse-1.8793, valid_pr--0.3353
2024-10-10 08:53:06 - INFO - epoch-89, train_loss-0.0791, train_rmse-0.2813, valid_rmse-1.8730, valid_pr--0.3318
2024-10-10 08:53:08 - INFO - epoch-90, train_loss-0.0805, train_rmse-0.2837, valid_rmse-1.8692, valid_pr--0.3349
2024-10-10 08:53:11 - INFO - epoch-91, train_loss-0.0891, train_rmse-0.2986, valid_rmse-1.8765, valid_pr--0.3368
2024-10-10 08:53:14 - INFO - epoch-92, train_loss-0.0678, train_rmse-0.2604, valid_rmse-1.8710, valid_pr--0.3305
2024-10-10 08:53:17 - INFO - epoch-93, train_loss-0.0683, train_rmse-0.2613, valid_rmse-1.8768, valid_pr--0.3339
2024-10-10 08:53:20 - INFO - epoch-94, train_loss-0.0564, train_rmse-0.2375, valid_rmse-1.8759, valid_pr--0.3382
2024-10-10 08:53:23 - INFO - epoch-95, train_loss-0.0697, train_rmse-0.2640, valid_rmse-1.8733, valid_pr--0.3391
2024-10-10 08:53:26 - INFO - epoch-96, train_loss-0.0467, train_rmse-0.2160, valid_rmse-1.8704, valid_pr--0.3396
2024-10-10 08:53:29 - INFO - epoch-97, train_loss-0.0521, train_rmse-0.2283, valid_rmse-1.8634, valid_pr--0.3251
2024-10-10 08:53:32 - INFO - epoch-98, train_loss-0.0581, train_rmse-0.2410, valid_rmse-1.8587, valid_pr--0.3094
2024-10-10 08:53:35 - INFO - epoch-99, train_loss-0.0477, train_rmse-0.2184, valid_rmse-1.8588, valid_pr--0.3117
2024-10-10 08:53:38 - INFO - epoch-100, train_loss-0.0470, train_rmse-0.2167, valid_rmse-1.8592, valid_pr--0.3021
2024-10-10 08:53:41 - INFO - epoch-101, train_loss-0.0632, train_rmse-0.2514, valid_rmse-1.8627, valid_pr--0.3037
2024-10-10 08:53:44 - INFO - epoch-102, train_loss-0.0351, train_rmse-0.1873, valid_rmse-1.8674, valid_pr--0.3030
2024-10-10 08:53:47 - INFO - epoch-103, train_loss-0.0634, train_rmse-0.2518, valid_rmse-1.8746, valid_pr--0.3072
2024-10-10 08:53:50 - INFO - epoch-104, train_loss-0.0441, train_rmse-0.2100, valid_rmse-1.8757, valid_pr--0.2984
2024-10-10 08:53:53 - INFO - epoch-105, train_loss-0.0492, train_rmse-0.2218, valid_rmse-1.8739, valid_pr--0.2814
2024-10-10 08:53:56 - INFO - epoch-106, train_loss-0.0777, train_rmse-0.2787, valid_rmse-1.8752, valid_pr--0.2737
2024-10-10 08:53:58 - INFO - epoch-107, train_loss-0.0411, train_rmse-0.2027, valid_rmse-1.8764, valid_pr--0.2685
2024-10-10 08:54:01 - INFO - epoch-108, train_loss-0.0499, train_rmse-0.2234, valid_rmse-1.8750, valid_pr--0.2638
2024-10-10 08:54:05 - INFO - epoch-109, train_loss-0.0638, train_rmse-0.2525, valid_rmse-1.8751, valid_pr--0.2573
2024-10-10 08:54:08 - INFO - epoch-110, train_loss-0.0400, train_rmse-0.2001, valid_rmse-1.8698, valid_pr--0.2446
2024-10-10 08:54:10 - INFO - epoch-111, train_loss-0.0825, train_rmse-0.2872, valid_rmse-1.8795, valid_pr--0.2484
2024-10-10 08:54:10 - INFO - Early stopping in epoch 111. Best RMSE: 1.5751
2024-10-10 08:54:10 - INFO - Training finished and last epoch model saved for repeat 1.
wandb: - 0.022 MB of 0.022 MB uploadedwandb:                                                                                
wandb: 
wandb: Run history:
wandb:      epoch ▁▁▁▁▁▂▂▂▂▂▃▃▃▃▃▃▃▄▄▄▅▅▅▅▅▆▆▆▆▆▆▇▇▇▇▇▇███
wandb: train_loss █▄▄▃▃▂▂▂▂▂▁▁▁▁▁▁▁▁▁▁▁▁▁▁▁▁▁▁▁▁▁▁▁▁▁▁▁▁▁▁
wandb: train_rmse █▅▅▄▄▄▄▃▃▃▂▂▂▂▂▂▂▁▂▂▁▁▂▁▂▂▁▁▁▁▁▁▁▁▁▁▁▁▁▁
wandb:   valid_pr ▅▆█▄▃▃▃▂▂▂▂▂▁▁▁▁▂▂▂▂▂▃▃▃▃▃▃▂▂▂▂▂▂▂▂▂▂▃▃▃
wandb: valid_rmse █▇▆▅▂▁▂▃▅▆▇████▇▇▇▆▆▆▆▆▆▆▆▆▆▅▅▆▇▇▇▇▇▇▆▇▇
wandb: 
wandb: Run summary:
wandb:      epoch 111
wandb: train_loss 0.08251
wandb: train_rmse 0.28724
wandb:   valid_pr -0.24844
wandb: valid_rmse 1.87949
wandb: 
wandb: 🚀 View run repeat_1 at: https://wandb.ai/tzu-tang-lin/finetuning_rep/runs/lai2ju2e
wandb: ⭐️ View project at: https://wandb.ai/tzu-tang-lin/finetuning_rep
wandb: Synced 5 W&B file(s), 0 media file(s), 0 artifact file(s) and 0 other file(s)
wandb: Find logs at: ./wandb/run-20241010_084837-lai2ju2e/logs
wandb: Tracking run with wandb version 0.18.3
wandb: Run data is saved locally in /blue/yanjun.li/tzutang.lin/GIGN/GIGN/wandb/run-20241010_085413-w28ap2cj
wandb: Run `wandb offline` to turn off syncing.
wandb: Syncing run repeat_2
wandb: ⭐️ View project at https://wandb.ai/tzu-tang-lin/finetuning_rep
wandb: 🚀 View run at https://wandb.ai/tzu-tang-lin/finetuning_rep/runs/w28ap2cj
2024-10-10 08:54:13 - INFO - /blue/yanjun.li/tzutang.lin/GIGN/GIGN/finetuning_pdbbind.py
2024-10-10 08:54:13 - INFO - train data: 81
2024-10-10 08:54:13 - INFO - valid data: 10
model has been saved to ./pdbbind_rna_model_fineturn/20241010_084838_GIGN_repeat1/model/last_epoch-111, train_loss-0.0825, train_rmse-0.2872, valid_rmse-1.8795, valid_pr--0.2484.pt.
./pdbbind_rna_model_fineturn/20241010_085413_GIGN_repeat2/log/train
2024-10-10 08:54:16 - INFO - epoch-0, train_loss-3.3137, train_rmse-1.8204, valid_rmse-2.0025, valid_pr--0.2619
model has been saved to ./pdbbind_rna_model_fineturn/20241010_085413_GIGN_repeat2/model/epoch-0, train_loss-3.3137, train_rmse-1.8204, valid_rmse-2.0025, valid_pr--0.2619.pt.
2024-10-10 08:54:19 - INFO - epoch-1, train_loss-2.5066, train_rmse-1.5832, valid_rmse-1.9500, valid_pr--0.1438
model has been saved to ./pdbbind_rna_model_fineturn/20241010_085413_GIGN_repeat2/model/epoch-1, train_loss-2.5066, train_rmse-1.5832, valid_rmse-1.9500, valid_pr--0.1438.pt.
2024-10-10 08:54:22 - INFO - epoch-2, train_loss-2.0013, train_rmse-1.4147, valid_rmse-1.9223, valid_pr--0.0535
model has been saved to ./pdbbind_rna_model_fineturn/20241010_085413_GIGN_repeat2/model/epoch-2, train_loss-2.0013, train_rmse-1.4147, valid_rmse-1.9223, valid_pr--0.0535.pt.
2024-10-10 08:54:25 - INFO - epoch-3, train_loss-1.4282, train_rmse-1.1951, valid_rmse-1.8998, valid_pr--0.0618
model has been saved to ./pdbbind_rna_model_fineturn/20241010_085413_GIGN_repeat2/model/epoch-3, train_loss-1.4282, train_rmse-1.1951, valid_rmse-1.8998, valid_pr--0.0618.pt.
2024-10-10 08:54:28 - INFO - epoch-4, train_loss-1.0374, train_rmse-1.0185, valid_rmse-1.8445, valid_pr--0.0114
model has been saved to ./pdbbind_rna_model_fineturn/20241010_085413_GIGN_repeat2/model/epoch-4, train_loss-1.0374, train_rmse-1.0185, valid_rmse-1.8445, valid_pr--0.0114.pt.
2024-10-10 08:54:31 - INFO - epoch-5, train_loss-0.9887, train_rmse-0.9944, valid_rmse-1.7832, valid_pr-0.0396
model has been saved to ./pdbbind_rna_model_fineturn/20241010_085413_GIGN_repeat2/model/epoch-5, train_loss-0.9887, train_rmse-0.9944, valid_rmse-1.7832, valid_pr-0.0396.pt.
2024-10-10 08:54:34 - INFO - epoch-6, train_loss-0.8581, train_rmse-0.9263, valid_rmse-1.6932, valid_pr-0.1544
model has been saved to ./pdbbind_rna_model_fineturn/20241010_085413_GIGN_repeat2/model/epoch-6, train_loss-0.8581, train_rmse-0.9263, valid_rmse-1.6932, valid_pr-0.1544.pt.
2024-10-10 08:54:37 - INFO - epoch-7, train_loss-0.8120, train_rmse-0.9011, valid_rmse-1.6056, valid_pr-0.2913
model has been saved to ./pdbbind_rna_model_fineturn/20241010_085413_GIGN_repeat2/model/epoch-7, train_loss-0.8120, train_rmse-0.9011, valid_rmse-1.6056, valid_pr-0.2913.pt.
2024-10-10 08:54:40 - INFO - epoch-8, train_loss-0.6655, train_rmse-0.8158, valid_rmse-1.5404, valid_pr-0.4108
model has been saved to ./pdbbind_rna_model_fineturn/20241010_085413_GIGN_repeat2/model/epoch-8, train_loss-0.6655, train_rmse-0.8158, valid_rmse-1.5404, valid_pr-0.4108.pt.
2024-10-10 08:54:43 - INFO - epoch-9, train_loss-0.5638, train_rmse-0.7508, valid_rmse-1.5021, valid_pr-0.5061
model has been saved to ./pdbbind_rna_model_fineturn/20241010_085413_GIGN_repeat2/model/epoch-9, train_loss-0.5638, train_rmse-0.7508, valid_rmse-1.5021, valid_pr-0.5061.pt.
2024-10-10 08:54:46 - INFO - epoch-10, train_loss-0.5465, train_rmse-0.7393, valid_rmse-1.4714, valid_pr-0.5691
model has been saved to ./pdbbind_rna_model_fineturn/20241010_085413_GIGN_repeat2/model/epoch-10, train_loss-0.5465, train_rmse-0.7393, valid_rmse-1.4714, valid_pr-0.5691.pt.
2024-10-10 08:54:49 - INFO - epoch-11, train_loss-0.4974, train_rmse-0.7053, valid_rmse-1.4497, valid_pr-0.6310
model has been saved to ./pdbbind_rna_model_fineturn/20241010_085413_GIGN_repeat2/model/epoch-11, train_loss-0.4974, train_rmse-0.7053, valid_rmse-1.4497, valid_pr-0.6310.pt.
2024-10-10 08:54:52 - INFO - epoch-12, train_loss-0.4634, train_rmse-0.6808, valid_rmse-1.4497, valid_pr-0.6694
model has been saved to ./pdbbind_rna_model_fineturn/20241010_085413_GIGN_repeat2/model/epoch-12, train_loss-0.4634, train_rmse-0.6808, valid_rmse-1.4497, valid_pr-0.6694.pt.
2024-10-10 08:54:55 - INFO - epoch-13, train_loss-0.4406, train_rmse-0.6637, valid_rmse-1.4581, valid_pr-0.6389
2024-10-10 08:54:58 - INFO - epoch-14, train_loss-0.4763, train_rmse-0.6902, valid_rmse-1.4777, valid_pr-0.4970
2024-10-10 08:55:02 - INFO - epoch-15, train_loss-0.3604, train_rmse-0.6003, valid_rmse-1.5069, valid_pr-0.3021
2024-10-10 08:55:05 - INFO - epoch-16, train_loss-0.3297, train_rmse-0.5742, valid_rmse-1.5375, valid_pr-0.1360
2024-10-10 08:55:08 - INFO - epoch-17, train_loss-0.3025, train_rmse-0.5500, valid_rmse-1.5638, valid_pr-0.0143
2024-10-10 08:55:11 - INFO - epoch-18, train_loss-0.2906, train_rmse-0.5391, valid_rmse-1.5904, valid_pr--0.0763
2024-10-10 08:55:14 - INFO - epoch-19, train_loss-0.2812, train_rmse-0.5302, valid_rmse-1.6149, valid_pr--0.1630
2024-10-10 08:55:17 - INFO - epoch-20, train_loss-0.2882, train_rmse-0.5369, valid_rmse-1.6437, valid_pr--0.2330
2024-10-10 08:55:20 - INFO - epoch-21, train_loss-0.2875, train_rmse-0.5362, valid_rmse-1.6624, valid_pr--0.2632
2024-10-10 08:55:23 - INFO - epoch-22, train_loss-0.2606, train_rmse-0.5105, valid_rmse-1.6823, valid_pr--0.2919
2024-10-10 08:55:26 - INFO - epoch-23, train_loss-0.1756, train_rmse-0.4191, valid_rmse-1.7005, valid_pr--0.3244
2024-10-10 08:55:29 - INFO - epoch-24, train_loss-0.2051, train_rmse-0.4528, valid_rmse-1.7127, valid_pr--0.3402
2024-10-10 08:55:32 - INFO - epoch-25, train_loss-0.2090, train_rmse-0.4571, valid_rmse-1.7198, valid_pr--0.3242
2024-10-10 08:55:35 - INFO - epoch-26, train_loss-0.1762, train_rmse-0.4197, valid_rmse-1.7307, valid_pr--0.3445
2024-10-10 08:55:38 - INFO - epoch-27, train_loss-0.1340, train_rmse-0.3661, valid_rmse-1.7523, valid_pr--0.3733
2024-10-10 08:55:41 - INFO - epoch-28, train_loss-0.1850, train_rmse-0.4302, valid_rmse-1.7629, valid_pr--0.3816
2024-10-10 08:55:45 - INFO - epoch-29, train_loss-0.2506, train_rmse-0.5006, valid_rmse-1.7722, valid_pr--0.3987
2024-10-10 08:55:47 - INFO - epoch-30, train_loss-0.1501, train_rmse-0.3875, valid_rmse-1.7781, valid_pr--0.4036
2024-10-10 08:55:50 - INFO - epoch-31, train_loss-0.1469, train_rmse-0.3833, valid_rmse-1.7837, valid_pr--0.3976
2024-10-10 08:55:53 - INFO - epoch-32, train_loss-0.1363, train_rmse-0.3692, valid_rmse-1.7849, valid_pr--0.3983
2024-10-10 08:55:56 - INFO - epoch-33, train_loss-0.1237, train_rmse-0.3517, valid_rmse-1.7892, valid_pr--0.3968
2024-10-10 08:55:59 - INFO - epoch-34, train_loss-0.1142, train_rmse-0.3380, valid_rmse-1.7837, valid_pr--0.3860
2024-10-10 08:56:02 - INFO - epoch-35, train_loss-0.1554, train_rmse-0.3942, valid_rmse-1.7809, valid_pr--0.3743
2024-10-10 08:56:05 - INFO - epoch-36, train_loss-0.1431, train_rmse-0.3783, valid_rmse-1.7777, valid_pr--0.3595
2024-10-10 08:56:08 - INFO - epoch-37, train_loss-0.1132, train_rmse-0.3365, valid_rmse-1.7833, valid_pr--0.3749
2024-10-10 08:56:12 - INFO - epoch-38, train_loss-0.1273, train_rmse-0.3568, valid_rmse-1.7831, valid_pr--0.3721
2024-10-10 08:56:14 - INFO - epoch-39, train_loss-0.1239, train_rmse-0.3520, valid_rmse-1.7721, valid_pr--0.3665
2024-10-10 08:56:18 - INFO - epoch-40, train_loss-0.1102, train_rmse-0.3320, valid_rmse-1.7678, valid_pr--0.3528
2024-10-10 08:56:21 - INFO - epoch-41, train_loss-0.1073, train_rmse-0.3276, valid_rmse-1.7795, valid_pr--0.3662
2024-10-10 08:56:24 - INFO - epoch-42, train_loss-0.1079, train_rmse-0.3284, valid_rmse-1.7852, valid_pr--0.3764
2024-10-10 08:56:27 - INFO - epoch-43, train_loss-0.1066, train_rmse-0.3265, valid_rmse-1.7902, valid_pr--0.3900
2024-10-10 08:56:30 - INFO - epoch-44, train_loss-0.1114, train_rmse-0.3338, valid_rmse-1.8004, valid_pr--0.4057
2024-10-10 08:56:33 - INFO - epoch-45, train_loss-0.1040, train_rmse-0.3225, valid_rmse-1.8133, valid_pr--0.4174
2024-10-10 08:56:36 - INFO - epoch-46, train_loss-0.0936, train_rmse-0.3059, valid_rmse-1.8192, valid_pr--0.4287
2024-10-10 08:56:39 - INFO - epoch-47, train_loss-0.1017, train_rmse-0.3189, valid_rmse-1.8297, valid_pr--0.4335
2024-10-10 08:56:42 - INFO - epoch-48, train_loss-0.1023, train_rmse-0.3199, valid_rmse-1.8310, valid_pr--0.4259
2024-10-10 08:56:45 - INFO - epoch-49, train_loss-0.1073, train_rmse-0.3275, valid_rmse-1.8284, valid_pr--0.4187
2024-10-10 08:56:48 - INFO - epoch-50, train_loss-0.1018, train_rmse-0.3190, valid_rmse-1.8221, valid_pr--0.4292
2024-10-10 08:56:51 - INFO - epoch-51, train_loss-0.1217, train_rmse-0.3488, valid_rmse-1.8259, valid_pr--0.4287
2024-10-10 08:56:55 - INFO - epoch-52, train_loss-0.0952, train_rmse-0.3085, valid_rmse-1.8271, valid_pr--0.4338
2024-10-10 08:56:58 - INFO - epoch-53, train_loss-0.0713, train_rmse-0.2671, valid_rmse-1.8273, valid_pr--0.4353
2024-10-10 08:57:01 - INFO - epoch-54, train_loss-0.0917, train_rmse-0.3029, valid_rmse-1.8228, valid_pr--0.4333
2024-10-10 08:57:04 - INFO - epoch-55, train_loss-0.0953, train_rmse-0.3086, valid_rmse-1.8276, valid_pr--0.4401
2024-10-10 08:57:07 - INFO - epoch-56, train_loss-0.0891, train_rmse-0.2985, valid_rmse-1.8348, valid_pr--0.4468
2024-10-10 08:57:10 - INFO - epoch-57, train_loss-0.0927, train_rmse-0.3045, valid_rmse-1.8364, valid_pr--0.4491
2024-10-10 08:57:13 - INFO - epoch-58, train_loss-0.0646, train_rmse-0.2541, valid_rmse-1.8318, valid_pr--0.4374
2024-10-10 08:57:16 - INFO - epoch-59, train_loss-0.0544, train_rmse-0.2333, valid_rmse-1.8249, valid_pr--0.4313
2024-10-10 08:57:19 - INFO - epoch-60, train_loss-0.1088, train_rmse-0.3299, valid_rmse-1.8134, valid_pr--0.4142
2024-10-10 08:57:22 - INFO - epoch-61, train_loss-0.0776, train_rmse-0.2785, valid_rmse-1.8054, valid_pr--0.3924
2024-10-10 08:57:25 - INFO - epoch-62, train_loss-0.0561, train_rmse-0.2369, valid_rmse-1.7953, valid_pr--0.3689
2024-10-10 08:57:28 - INFO - epoch-63, train_loss-0.0999, train_rmse-0.3160, valid_rmse-1.7881, valid_pr--0.3544
2024-10-10 08:57:31 - INFO - epoch-64, train_loss-0.0549, train_rmse-0.2342, valid_rmse-1.7748, valid_pr--0.3264
2024-10-10 08:57:34 - INFO - epoch-65, train_loss-0.0608, train_rmse-0.2466, valid_rmse-1.7658, valid_pr--0.3063
2024-10-10 08:57:37 - INFO - epoch-66, train_loss-0.0600, train_rmse-0.2450, valid_rmse-1.7509, valid_pr--0.2723
2024-10-10 08:57:40 - INFO - epoch-67, train_loss-0.0766, train_rmse-0.2767, valid_rmse-1.7486, valid_pr--0.2566
2024-10-10 08:57:43 - INFO - epoch-68, train_loss-0.0715, train_rmse-0.2673, valid_rmse-1.7433, valid_pr--0.2379
2024-10-10 08:57:46 - INFO - epoch-69, train_loss-0.0677, train_rmse-0.2603, valid_rmse-1.7334, valid_pr--0.2170
2024-10-10 08:57:49 - INFO - epoch-70, train_loss-0.0584, train_rmse-0.2417, valid_rmse-1.7309, valid_pr--0.2036
2024-10-10 08:57:52 - INFO - epoch-71, train_loss-0.0561, train_rmse-0.2369, valid_rmse-1.7236, valid_pr--0.1933
2024-10-10 08:57:55 - INFO - epoch-72, train_loss-0.0939, train_rmse-0.3065, valid_rmse-1.7158, valid_pr--0.1746
2024-10-10 08:57:58 - INFO - epoch-73, train_loss-0.0866, train_rmse-0.2943, valid_rmse-1.7213, valid_pr--0.1783
2024-10-10 08:58:01 - INFO - epoch-74, train_loss-0.0702, train_rmse-0.2649, valid_rmse-1.7242, valid_pr--0.1892
2024-10-10 08:58:04 - INFO - epoch-75, train_loss-0.0496, train_rmse-0.2228, valid_rmse-1.7276, valid_pr--0.1943
2024-10-10 08:58:07 - INFO - epoch-76, train_loss-0.0577, train_rmse-0.2402, valid_rmse-1.7268, valid_pr--0.1961
2024-10-10 08:58:10 - INFO - epoch-77, train_loss-0.0756, train_rmse-0.2749, valid_rmse-1.7320, valid_pr--0.2111
2024-10-10 08:58:13 - INFO - epoch-78, train_loss-0.0665, train_rmse-0.2578, valid_rmse-1.7417, valid_pr--0.2363
2024-10-10 08:58:16 - INFO - epoch-79, train_loss-0.0961, train_rmse-0.3099, valid_rmse-1.7440, valid_pr--0.2603
2024-10-10 08:58:20 - INFO - epoch-80, train_loss-0.0704, train_rmse-0.2654, valid_rmse-1.7542, valid_pr--0.2926
2024-10-10 08:58:22 - INFO - epoch-81, train_loss-0.0561, train_rmse-0.2368, valid_rmse-1.7687, valid_pr--0.3240
2024-10-10 08:58:25 - INFO - epoch-82, train_loss-0.0700, train_rmse-0.2646, valid_rmse-1.7846, valid_pr--0.3494
2024-10-10 08:58:28 - INFO - epoch-83, train_loss-0.0507, train_rmse-0.2251, valid_rmse-1.7924, valid_pr--0.3716
2024-10-10 08:58:31 - INFO - epoch-84, train_loss-0.0667, train_rmse-0.2582, valid_rmse-1.8013, valid_pr--0.3898
2024-10-10 08:58:34 - INFO - epoch-85, train_loss-0.0512, train_rmse-0.2262, valid_rmse-1.8004, valid_pr--0.4012
2024-10-10 08:58:37 - INFO - epoch-86, train_loss-0.0767, train_rmse-0.2769, valid_rmse-1.7921, valid_pr--0.4034
2024-10-10 08:58:40 - INFO - epoch-87, train_loss-0.0757, train_rmse-0.2751, valid_rmse-1.7920, valid_pr--0.4066
2024-10-10 08:58:43 - INFO - epoch-88, train_loss-0.0639, train_rmse-0.2528, valid_rmse-1.7901, valid_pr--0.4021
2024-10-10 08:58:46 - INFO - epoch-89, train_loss-0.0516, train_rmse-0.2271, valid_rmse-1.7902, valid_pr--0.4036
2024-10-10 08:58:49 - INFO - epoch-90, train_loss-0.0736, train_rmse-0.2713, valid_rmse-1.7838, valid_pr--0.3968
2024-10-10 08:58:52 - INFO - epoch-91, train_loss-0.0529, train_rmse-0.2300, valid_rmse-1.7746, valid_pr--0.3822
2024-10-10 08:58:55 - INFO - epoch-92, train_loss-0.0679, train_rmse-0.2606, valid_rmse-1.7697, valid_pr--0.3753
2024-10-10 08:58:58 - INFO - epoch-93, train_loss-0.0571, train_rmse-0.2391, valid_rmse-1.7692, valid_pr--0.3718
2024-10-10 08:59:02 - INFO - epoch-94, train_loss-0.0551, train_rmse-0.2348, valid_rmse-1.7660, valid_pr--0.3706
2024-10-10 08:59:05 - INFO - epoch-95, train_loss-0.0681, train_rmse-0.2610, valid_rmse-1.7637, valid_pr--0.3595
2024-10-10 08:59:08 - INFO - epoch-96, train_loss-0.0974, train_rmse-0.3121, valid_rmse-1.7679, valid_pr--0.3625
2024-10-10 08:59:11 - INFO - epoch-97, train_loss-0.0590, train_rmse-0.2429, valid_rmse-1.7683, valid_pr--0.3605
2024-10-10 08:59:14 - INFO - epoch-98, train_loss-0.0639, train_rmse-0.2527, valid_rmse-1.7716, valid_pr--0.3580
2024-10-10 08:59:17 - INFO - epoch-99, train_loss-0.0662, train_rmse-0.2573, valid_rmse-1.7757, valid_pr--0.3567
2024-10-10 08:59:20 - INFO - epoch-100, train_loss-0.0624, train_rmse-0.2498, valid_rmse-1.7773, valid_pr--0.3569
2024-10-10 08:59:23 - INFO - epoch-101, train_loss-0.0677, train_rmse-0.2603, valid_rmse-1.7807, valid_pr--0.3600
2024-10-10 08:59:26 - INFO - epoch-102, train_loss-0.0455, train_rmse-0.2133, valid_rmse-1.7782, valid_pr--0.3550
2024-10-10 08:59:29 - INFO - epoch-103, train_loss-0.0615, train_rmse-0.2480, valid_rmse-1.7772, valid_pr--0.3482
2024-10-10 08:59:32 - INFO - epoch-104, train_loss-0.0451, train_rmse-0.2124, valid_rmse-1.7786, valid_pr--0.3438
2024-10-10 08:59:35 - INFO - epoch-105, train_loss-0.0504, train_rmse-0.2245, valid_rmse-1.7782, valid_pr--0.3293
2024-10-10 08:59:38 - INFO - epoch-106, train_loss-0.0411, train_rmse-0.2027, valid_rmse-1.7616, valid_pr--0.3043
2024-10-10 08:59:41 - INFO - epoch-107, train_loss-0.0363, train_rmse-0.1904, valid_rmse-1.7553, valid_pr--0.2931
2024-10-10 08:59:44 - INFO - epoch-108, train_loss-0.0621, train_rmse-0.2492, valid_rmse-1.7532, valid_pr--0.2912
2024-10-10 08:59:47 - INFO - epoch-109, train_loss-0.0527, train_rmse-0.2296, valid_rmse-1.7439, valid_pr--0.2730
2024-10-10 08:59:50 - INFO - epoch-110, train_loss-0.0383, train_rmse-0.1957, valid_rmse-1.7464, valid_pr--0.2767
2024-10-10 08:59:54 - INFO - epoch-111, train_loss-0.0417, train_rmse-0.2041, valid_rmse-1.7397, valid_pr--0.2634
2024-10-10 08:59:57 - INFO - epoch-112, train_loss-0.0425, train_rmse-0.2062, valid_rmse-1.7362, valid_pr--0.2593
2024-10-10 09:00:00 - INFO - epoch-113, train_loss-0.0553, train_rmse-0.2351, valid_rmse-1.7327, valid_pr--0.2664
2024-10-10 09:00:00 - INFO - Early stopping in epoch 113. Best RMSE: 1.4497
2024-10-10 09:00:00 - INFO - Training finished and last epoch model saved for repeat 2.
wandb: - 0.022 MB of 0.022 MB uploadedwandb:                                                                                
wandb: 
wandb: Run history:
wandb:      epoch ▁▁▁▁▁▂▂▂▂▂▃▃▃▃▃▄▄▄▄▄▄▄▅▅▅▅▅▆▆▆▆▆▇▇▇▇▇▇██
wandb: train_loss █▅▃▃▂▂▂▂▂▂▁▁▁▁▁▁▁▁▁▁▁▁▁▁▁▁▁▁▁▁▁▁▁▁▁▁▁▁▁▁
wandb: train_rmse █▇▄▃▃▃▃▃▃▃▂▂▂▂▂▂▂▁▂▂▁▁▂▁▁▁▁▁▁▁▁▁▁▁▁▁▁▁▁▁
wandb:   valid_pr ▂▃▆██▄▂▁▁▁▁▁▁▁▁▁▁▁▁▁▁▂▂▂▂▂▂▂▁▁▁▁▁▁▂▂▂▂▂▂
wandb: valid_rmse █▇▇▂▁▂▂▃▃▄▅▅▅▅▅▅▅▅▅▆▆▆▆▆▆▅▅▅▅▅▅▅▅▅▅▅▅▅▅▅
wandb: 
wandb: Run summary:
wandb:      epoch 113
wandb: train_loss 0.05529
wandb: train_rmse 0.23514
wandb:   valid_pr -0.26642
wandb: valid_rmse 1.73266
wandb: 
wandb: 🚀 View run repeat_2 at: https://wandb.ai/tzu-tang-lin/finetuning_rep/runs/w28ap2cj
wandb: ⭐️ View project at: https://wandb.ai/tzu-tang-lin/finetuning_rep
wandb: Synced 5 W&B file(s), 0 media file(s), 0 artifact file(s) and 0 other file(s)
wandb: Find logs at: ./wandb/run-20241010_085413-w28ap2cj/logs
model has been saved to ./pdbbind_rna_model_fineturn/20241010_085413_GIGN_repeat2/model/last_epoch-113, train_loss-0.0553, train_rmse-0.2351, valid_rmse-1.7327, valid_pr--0.2664.pt.
